GARMIN GNS database card programmer 
Part numbers:
"older" 011-01277-00 (this file here!)
"newer" 010-10579-20


    =========================== USB Port2 ===========================

Connection Status        : 0x01 (Device is connected)
Port Chain               : 1-9-2
Properties               : 0x01
 IsUserConnectable       : yes
 PortIsDebugCapable      : no
 PortHasMultiCompanions  : no
 PortConnectorIsTypeC    : no
ConnectionIndex          : 0x02 (Port 2)
CompanionIndex           : 0
 CompanionHubSymLnk      : USB#VID_0BDA&PID_0411#5&3a692ce1&0&25#{f18a0e88-c30c-11d0-8815-00a0c906bed8}
 CompanionPortNumber     : 0x02 (Port 2)
 -> CompanionPortChain   : 1-25-2

      ========================== Summary =========================
Vendor ID                : 0x091E (Garmin International)
Product ID               : 0x1300
Manufacturer String      : "GARMIN Corp."
Product String           : "USB Data Card Programmer"
Serial                   : ---
USB Version              : 1.0 (12 Mbit/s FullSpeed)
Port maximum Speed       : High-Speed (Companion Port 1-25-2 is doing the SuperSpeed)
Device maximum Speed     : Full-Speed
Device Connection Speed  : Full-Speed
Self powered             : no
Demanded Current         : 500 mA
Used Endpoints           : 3

      ======================== USB Device ========================

        +++++++++++++++++ Device Information ++++++++++++++++++
Friendly Name            : USB Data Card Programmer
Device Description       : USB Data Card Programmer
Device Path 1            : \\?\USB#VID_091E&PID_1300#6&3026ef5a&0&2#{a5dcbf10-6530-11d2-901f-00c04fb951ed} (GUID_DEVINTERFACE_USB_DEVICE)
Device Path 2            : \\?\USB#VID_091E&PID_1300#6&3026ef5a&0&2#{dee824ef-729b-4a0e-9c14-b7117d33a817} (GUID_DEVINTERFACE_WINUSB)
Device Path 3            : \\?\USB#VID_091E&PID_1300#6&3026ef5a&0&2#{b9e70959-e5fc-4e65-b239-11a1bf5fde40}
Kernel Name              : \Device\USBPDO-10
Device ID                : USB\VID_091E&PID_1300\6&3026EF5A&0&2
Hardware IDs             : USB\VID_091E&PID_1300&REV_0001 USB\VID_091E&PID_1300
Driver KeyName           : {88bae032-5a81-49f0-bc3d-a4ff138216d6}\0003 (GUID_DEVCLASS_USBDEVICE)
Driver                   : \SystemRoot\System32\drivers\WinUSB.SYS (Version: 10.0.26100.1150  Date: 2024-10-05  Company: Microsoft Corporation)
Driver Inf               : C:\WINDOWS\inf\oem149.inf
Legacy BusType           : PNPBus
Class                    : USBDevice
Class GUID               : {88bae032-5a81-49f0-bc3d-a4ff138216d6} (GUID_DEVCLASS_USBDEVICE)
Service                  : WinUSB
Enumerator               : USB
Location Info            : Port_#0002.Hub_#0008
Address                  : 2
Location IDs             : PCIROOT(0)#PCI(1400)#USBROOT(0)#USB(9)#USB(2), ACPI(_SB_)#ACPI(PC00)#ACPI(XHCI)#ACPI(RHUB)#ACPI(HS09)#USB(2)
Container ID             : {02571210-64e3-11f0-8665-6479f03928bb}
Manufacturer Info        : Garmin International
Capabilities             : 0x04 (Removable)
Status                   : 0x0180600A (DN_DRIVER_LOADED, DN_STARTED, DN_DISABLEABLE, DN_REMOVABLE, DN_NT_ENUMERATOR, DN_NT_DRIVER)
Problem Code             : 0
First Install Date       : 2025-07-19 23:07:54
Last Arrival Date        : 2025-07-19 23:25:14
EnhancedPowerMgmtEnabled : 0
Power State              : D0 (supported: D0, D2, D3, wake from D0, wake from D2)

        ---------------- Connection Information ---------------
Connection Index         : 0x02 (Port 2)
Connection Status        : 0x01 (DeviceConnected)
Current Config Value     : 0x01 (Configuration 1)
Device Address           : 0x1C (28)
Is Hub                   : 0x00 (no)
Device Bus Speed         : 0x01 (Full-Speed)
Number of open Pipes     : 0x02 (2 pipes to data endpoints)
Pipe[0]                  : EndpointID=2  Direction=IN   ScheduleOffset=0  Type=Bulk  wMaxPacketSize=0x40    bInterval=0  
Pipe[1]                  : EndpointID=2  Direction=OUT  ScheduleOffset=0  Type=Bulk  wMaxPacketSize=0x40    bInterval=0  
Data (HexDump)           : 02 00 00 00 12 01 00 01 00 00 FF 40 1E 09 00 13   ...........@....
                           01 00 01 02 00 01 01 01 00 1C 00 02 00 00 00 01   ................
                           00 00 00 07 05 82 02 40 00 00 00 00 00 00 07 05   .......@........
                           02 02 40 00 00 00 00 00 00                        ..@......

        --------------- Connection Information V2 -------------
Connection Index         : 0x02 (2)
Length                   : 0x10 (16 bytes)
SupportedUsbProtocols    : 0x03
 Usb110                  : 1 (yes, port supports USB 1.1)
 Usb200                  : 1 (yes, port supports USB 2.0)
 Usb300                  : 0 (no, port not supports USB 3.0) -> but Companion Port 1-25-2 does
 ReservedMBZ             : 0x00
Flags                    : 0x00
 DevIsOpAtSsOrHigher     : 0 (Device is not operating at SuperSpeed or higher)
 DevIsSsCapOrHigher      : 0 (Device is not SuperSpeed capable or higher)
 DevIsOpAtSsPlusOrHigher : 0 (Device is not operating at SuperSpeedPlus or higher)
 DevIsSsPlusCapOrHigher  : 0 (Device is not SuperSpeedPlus capable or higher)
 ReservedMBZ             : 0x00
Data (HexDump)           : 02 00 00 00 10 00 00 00 03 00 00 00 00 00 00 00   ................

    ---------------------- Device Descriptor ----------------------
bLength                  : 0x12 (18 bytes)
bDescriptorType          : 0x01 (Device Descriptor)
bcdUSB                   : 0x100 (USB Version 1.0)
bDeviceClass             : 0x00 (defined by the interface descriptors)
bDeviceSubClass          : 0x00
bDeviceProtocol          : 0xFF
bMaxPacketSize0          : 0x40 (64 bytes)
idVendor                 : 0x091E (Garmin International)
idProduct                : 0x1300
bcdDevice                : 0x0001
iManufacturer            : 0x01 (String Descriptor 1)
 Language 0x0409         : "GARMIN Corp."
iProduct                 : 0x02 (String Descriptor 2)
 Language 0x0409         : "USB Data Card Programmer"
iSerialNumber            : 0x00 (No String Descriptor)
bNumConfigurations       : 0x01 (1 Configuration)
Data (HexDump)           : 12 01 00 01 00 00 FF 40 1E 09 00 13 01 00 01 02   .......@........
                           00 01                                             ..

    ------------------ Configuration Descriptor -------------------
bLength                  : 0x09 (9 bytes)
bDescriptorType          : 0x02 (Configuration Descriptor)
wTotalLength             : 0x0020 (32 bytes)
bNumInterfaces           : 0x01 (1 Interface)
bConfigurationValue      : 0x01 (Configuration 1)
iConfiguration           : 0x00 (No String Descriptor)
bmAttributes             : 0x80
 D7: Bus Powered         : 0x01 (yes)
 D6: Self Powered        : 0x00 (no)
 D5: Remote Wakeup       : 0x00 (no)
 D4..0: Reserved, set 0  : 0x00
MaxPower                 : 0xFA (500 mA)
Data (HexDump)           : 09 02 20 00 01 01 00 80 FA 09 04 00 00 02 FF 00   .. .............
                           FF 00 07 05 82 02 40 00 00 07 05 02 02 40 00 00   ......@......@..

        ---------------- Interface Descriptor -----------------
bLength                  : 0x09 (9 bytes)
bDescriptorType          : 0x04 (Interface Descriptor)
bInterfaceNumber         : 0x00 (Interface 0)
bAlternateSetting        : 0x00
bNumEndpoints            : 0x02 (2 Endpoints)
bInterfaceClass          : 0xFF (Vendor Specific)
bInterfaceSubClass       : 0x00
bInterfaceProtocol       : 0xFF
iInterface               : 0x00 (No String Descriptor)
Data (HexDump)           : 09 04 00 00 02 FF 00 FF 00                        .........

        ----------------- Endpoint Descriptor -----------------
bLength                  : 0x07 (7 bytes)
bDescriptorType          : 0x05 (Endpoint Descriptor)
bEndpointAddress         : 0x82 (Direction=IN EndpointID=2)
bmAttributes             : 0x02 (TransferType=Bulk)
wMaxPacketSize           : 0x0040 (64 bytes)
bInterval                : 0x00 (ignored)
Data (HexDump)           : 07 05 82 02 40 00 00                              ....@..

        ----------------- Endpoint Descriptor -----------------
bLength                  : 0x07 (7 bytes)
bDescriptorType          : 0x05 (Endpoint Descriptor)
bEndpointAddress         : 0x02 (Direction=OUT EndpointID=2)
bmAttributes             : 0x02 (TransferType=Bulk)
wMaxPacketSize           : 0x0040 (64 bytes)
bInterval                : 0x00 (ignored)
Data (HexDump)           : 07 05 02 02 40 00 00                              ....@..

      -------------------- String Descriptors -------------------
             ------ String Descriptor 0 ------
bLength                  : 0x04 (4 bytes)
bDescriptorType          : 0x03 (String Descriptor)
Language ID[0]           : 0x0409 (English - United States)
Data (HexDump)           : 04 03 09 04                                       ....
             ------ String Descriptor 1 ------
bLength                  : 0x1A (26 bytes)
bDescriptorType          : 0x03 (String Descriptor)
Language 0x0409          : "GARMIN Corp."
Data (HexDump)           : 1A 03 47 00 41 00 52 00 4D 00 49 00 4E 00 20 00   ..G.A.R.M.I.N. .
                           43 00 6F 00 72 00 70 00 2E 00                     C.o.r.p...
             ------ String Descriptor 2 ------
bLength                  : 0x32 (50 bytes)
bDescriptorType          : 0x03 (String Descriptor)
Language 0x0409          : "USB Data Card Programmer"
Data (HexDump)           : 32 03 55 00 53 00 42 00 20 00 44 00 61 00 74 00   2.U.S.B. .D.a.t.
                           61 00 20 00 43 00 61 00 72 00 64 00 20 00 50 00   a. .C.a.r.d. .P.
                           72 00 6F 00 67 00 72 00 61 00 6D 00 6D 00 65 00   r.o.g.r.a.m.m.e.
                           72 00                                             r.
